{
  "schema": "vitamux.ingest.batch/1",
  "connection_id": "conn_0190a1b2c3d47e8f9a0b1c2d3e4f5a6b",
  "client": {"kind": "device", "name": "healthbridge-ios", "version": "0.2.0"},
  "items": [
    {
      "stream": "healthkit.samples.v1",
      "external_key": "HKQuantityTypeIdentifierHeartRate:anchor:b3c1d2e3",
      "fetched_at": "2026-09-14T09:02:11+02:00",
      "content_type": "application/json",
      "request": {"endpoint": "HKAnchoredObjectQuery", "params": {"type": "HKQuantityTypeIdentifierHeartRate", "limit": 2000}},
      "body": {
        "type": "HKQuantityTypeIdentifierHeartRate",
        "anchor": {"before_hash": "b3c1d2e3", "after_hash": "7a90f1e2", "query_started_at": "2026-09-14T08:00:03+02:00"},
        "samples": [{
          "uuid": "6F0D0000-0000-4000-8000-000000000001",
          "start": "2026-09-14T07:31:05.120+02:00",
          "end": "2026-09-14T07:31:05.120+02:00",
          "value": 61,
          "unit": "count/min",
          "source_revision": {"bundle_id": "com.apple.health.00000000-0000-4000-8000-000000000002", "name": "Synthetic Watch", "version": "11.0", "product_type": "Watch7,1", "os_version": "11.0.0"},
          "device": {"name": "Synthetic Watch", "manufacturer": "Apple Inc.", "model": "Watch", "hardware_version": "Watch7,1", "software_version": "11.0"},
          "metadata": {"HKMetadataKeyHeartRateMotionContext": 1, "HKTimeZone": "Europe/Amsterdam"},
          "was_user_entered": false
        }],
        "deleted": [{"uuid": "0A1B0000-0000-4000-8000-000000000003"}]
      }
    }
  ]
}
